"Description","rules"
"hreinsa dálkinn tollameðferð í innfluttningi, þegar um innfluttning er að ræða","TOLLMEÐFERÐ IS NOT NULL AND EINK = 'M'"
"Breyti einingafjölda í sérstökum tilfellum og gera einingarnar réttar þeas 0 fyrir kg og 1 fyrir stykki","EINK = 'M' AND EIFJ > 0 AND TLSK IN (SELECT TLSK FROM STJÓRN WHERE AFMX IS NULL OR AFMX <> 'A')"
"Breyti einingafjölda í sérstökum tilfellum og gera einingarnar réttar þeas 0 fyrir kg og 1 fyrir stykki","EINK = 'M' AND EIFJ > 0 AND TLSK IN (SELECT TLSK FROM STJÓRN WHERE AFMX IS NULL OR (AFMX <> 'A' AND AFMX <> 'R'))"
"Eyði út sérstökum tollskrárnúmerum og flyt yfir í töfluna eytt+ár, Það eru þeir sem byrja á 98 og 990000","TLSK LIKE '98%' OR TLSK LIKE '990000%'"
"Eyði út innflutning, þeas eyða út undanþágum","EINK= 'M' AND UNDANÞÁGA IN (SELECT UNDANÞÁGA FROM UNDANÞÁGUR)"
"Eyði út útflutning, þeas eyða út útflutningi þar sem tollameðferð er 11,12,13,14,20,22,32,34,35","EINK= 'X' AND TOLLMEÐFERÐ IN ('11','12','13','14','20','22','32','34','35')"
"Eyði út 0 færslum, bæði inn- og útfluttingi, þeas í útfluttningi er fob-verð 0 og í innfluttningi er bæði fob og cif verð 0.","EINK= 'M' AND FOB_VERÐ <= 0 AND CIF_VERÐ <= 0"
"Eyði út færslum sem eru með í útfluttningi fob-verð undir 500 kr.","EINK= 'X' AND FOB_VERÐ <= 500"
"Eyði út færslum sem eru með í innfluttningi er bæði fob og cif verð undir 500 kr.","EINK= 'M' AND FOB_VERÐ <= 500 AND CIF_VERÐ <= 500"
"Eyði út færslum þar sem þyngd er ekki með neinum gildi, þeas null.","ÞYNGD IS NULL"
"Breyti tollskránúmer í sérstökum tilfellum og flyt yfir í villur+ár If tollmeðferð = 30, then breyta TLSK í 99909901, þetta eru vörur sem hafa áður verið innfluttar en eru endursendar til útlanda, t.d. vegna ábyrgðar.","EINK= 'X' AND TOLLMEÐFERÐ = 30"
"Tollstaður ekki skráður","RIGHT(AFGRMAN,2) = (CASE WHEN MONTH(GETDATE()) = 1 THEN 12 ELSE MONTH(GETDATE()) - 1 END) AND TOLLST IS NULL"
"Geymslunúmer ekki skráð","RIGHT(AFGRMAN,2) = (CASE WHEN MONTH(GETDATE()) = 1 THEN 12 ELSE MONTH(GETDATE()) - 1 END) AND GNR IS NULL"
"Kennitala ekki skráð","RIGHT(AFGRMAN,2) = (CASE WHEN MONTH(GETDATE()) = 1 THEN 12 ELSE MONTH(GETDATE()) - 1 END) AND KT IS NULL"
"Gjaldmiðill ekki skráður","RIGHT(AFGRMAN,2) = (CASE WHEN MONTH(GETDATE()) = 1 THEN 12 ELSE MONTH(GETDATE()) - 1 END) AND GJALDMIDILL IS NULL"
"Gengi ekki skráð","RIGHT(AFGRMAN,2) = (CASE WHEN MONTH(GETDATE()) = 1 THEN 12 ELSE MONTH(GETDATE()) - 1 END) AND GENGI IS NULL"
"Sendingarnúmer ekki skráð","RIGHT(AFGRMAN,2) = (CASE WHEN MONTH(GETDATE()) = 1 THEN 12 ELSE MONTH(GETDATE()) - 1 END) AND SENDNR IS NULL"
"Afgreiðslutegund ekki skráð","RIGHT(AFGRMAN,2) = (CASE WHEN MONTH(GETDATE()) = 1 THEN 12 ELSE MONTH(GETDATE()) - 1 END) AND AFGRTEG IS NULL"
"Tegund viðskipta ekki skráð","RIGHT(AFGRMAN,2) = (CASE WHEN MONTH(GETDATE()) = 1 THEN 12 ELSE MONTH(GETDATE()) - 1 END) AND EINK= 'X' AND TEG_VIÐSKIPTA IS NULL"
"Tollmeðferð ekki skráð","RIGHT(AFGRMAN,2) = (CASE WHEN MONTH(GETDATE()) = 1 THEN 12 ELSE MONTH(GETDATE()) - 1 END) AND EINK= 'X' AND TOLLMEÐFERÐ IS NULL"
"Flutningsfar ekki skráð","RIGHT(AFGRMAN,2) = (CASE WHEN MONTH(GETDATE()) = 1 THEN 12 ELSE MONTH(GETDATE()) - 1 END) AND FLUTNFAR IS NULL"
"Afgreiðsludagsetning ekki skráð","RIGHT(AFGRMAN,2) = (CASE WHEN MONTH(GETDATE()) = 1 THEN 12 ELSE MONTH(GETDATE()) - 1 END) AND AFGRDAGUR IS NULL"
"Afgreiðslumánuður ekki skráður","AFGRMAN IS NULL"
"Einkenni ekki skráð","RIGHT(AFGRMAN,2) = (CASE WHEN MONTH(GETDATE()) = 1 THEN 12 ELSE MONTH(GETDATE()) - 1 END) AND EINK IS NULL"
"Tollskrárnúmer ekki skráð","RIGHT(AFGRMAN,2) = (CASE WHEN MONTH(GETDATE()) = 1 THEN 12 ELSE MONTH(GETDATE()) - 1 END) AND TLSK IS NULL"
"Land ekki skráð","RIGHT(AFGRMAN,2) = (CASE WHEN MONTH(GETDATE()) = 1 THEN 12 ELSE MONTH(GETDATE()) - 1 END) AND LAND IS NULL"
"Einingafjöldi ekki skráður","RIGHT(AFGRMAN,2) = (CASE WHEN MONTH(GETDATE()) = 1 THEN 12 ELSE MONTH(GETDATE()) - 1 END) AND EIFJ IS NULL"
"þyngd ekki skráð","RIGHT(AFGRMAN,2) = (CASE WHEN MONTH(GETDATE()) = 1 THEN 12 ELSE MONTH(GETDATE()) - 1 END) AND ÞYNGD IS NULL"
"Fobverð ekki skráð","RIGHT(AFGRMAN,2) = (CASE WHEN MONTH(GETDATE()) = 1 THEN 12 ELSE MONTH(GETDATE()) - 1 END) AND FOB_VERÐ IS NULL"
"Cifverð ekki skráð í innfluttingi","RIGHT(AFGRMAN,2) = (CASE WHEN MONTH(GETDATE()) = 1 THEN 12 ELSE MONTH(GETDATE()) - 1 END) AND EINK= 'M' AND CIF_VERÐ IS NULL"
"Tollstöð/geymslunúmer er til fyrir","id IN (SELECT H.id FROM HRÁAR2019 H JOIN FÆRSLUR2019 F ON F.TOLLST = H.TOLLST AND F.GNR = H.GNR AND RIGHT(F.AFGRMAN,2) <> RIGHT(H.AFGRMAN,2) WHERE RIGHT(H.AFGRMAN,2) = (CASE WHEN MONTH(GETDATE()) = 1 THEN 12 ELSE MONTH(GETDATE()) - 1 END)) AND RIGHT(AFGRMAN,2) = (CASE WHEN MONTH(GETDATE()) = 1 THEN 12 ELSE MONTH(GETDATE()) - 1 END)"
"Kennitala ekki til á skrá","KT NOT IN (SELECT KENNITALA FROM FYRIRTÆKI WHERE KENNITALA NOT IN ('5505555579','6606666649')) AND KT NOT IN (SELECT KENNITALA FROM ÞJÓÐSKRÁ)"
"Gjaldmiðill ekki til","RIGHT(AFGRMAN,2) = (CASE WHEN MONTH(GETDATE()) = 1 THEN 12 ELSE MONTH(GETDATE()) - 1 END) AND GJALDMIDILL NOT IN (SELECT GJM FROM GJALDMIÐILL)"
"Afgreiðsludagsetning ekki rétt","RIGHT(AFGRMAN,2) = (CASE WHEN MONTH(GETDATE()) = 1 THEN 12 ELSE MONTH(GETDATE()) - 1 END) AND MONTH(AFGRDAGUR) <> (CASE WHEN MONTH(GETDATE()) = 1 THEN 12 ELSE MONTH(GETDATE()) - 1 END) AND SUBSTRING(GNR,3,1) NOT IN ('X','M')"
"Einkenni skal vera X eða M","RIGHT(AFGRMAN,2) = (CASE WHEN MONTH(GETDATE()) = 1 THEN 12 ELSE MONTH(GETDATE()) - 1 END) AND EINK != 'X' AND EINK != 'M'"
"Afgreiðslumánuður ekki rétt","RIGHT(AFGRMAN,2) != (CASE WHEN MONTH(GETDATE()) = 1 THEN 12 ELSE MONTH(GETDATE()) - 1 END)"
"Tollskrárnúmer ekki til eða ógilt","RIGHT(AFGRMAN,2) = (CASE WHEN MONTH(GETDATE()) = 1 THEN 12 ELSE MONTH(GETDATE()) - 1 END) AND TLSK IN (SELECT TLSK FROM STJÓRN_2019)"
"Land ekki til í landatöflu eða ógilt","RIGHT(AFGRMAN,2) = (CASE WHEN MONTH(GETDATE()) = 1 THEN 12 ELSE MONTH(GETDATE()) - 1 END) AND LAND IN (SELECT LAND FROM LAND WHERE ER_EKKI_TIL_AR0=1) AND LAND NOT IN (SELECT LAND FROM LAND)"
"Einingafjöldi skal skráður í innfluttingi","id IN (SELECT id FROM HRÁAR2019 f, stjórn_2019 s WHERE S.TLSK = F.TLSK AND EIFJ = 0 AND EINK= 'M' AND AFMX = 'A' AND RIGHT(AFGRMAN,2) = (CASE WHEN MONTH(GETDATE()) = 1 THEN 12 ELSE MONTH(GETDATE()) - 1 END))"
"Einingafjöldi skal skráður í útfluttingi","id IN (SELECT id FROM HRÁAR2019 f, stjórn_2019 s WHERE S.TLSK = F.TLSK AND EIFJ = 0 AND EINK= 'X' AND (AFMX = 'R' OR AFMX = 'A')) AND RIGHT(AFGRMAN,2) = (CASE WHEN MONTH(GETDATE()) = 1 THEN 12 ELSE MONTH(GETDATE()) - 1 END)"
"Ekki skal skrá cif verð í útfluttingi bara í innfluttingi","RIGHT(AFGRMAN,2) = (CASE WHEN MONTH(GETDATE()) = 1 THEN 12 ELSE MONTH(GETDATE()) - 1 END) AND EINK= 'X' AND CIF_VERÐ > 0"
"Fobverð hærra en cifverð","RIGHT(AFGRMAN,2) = (CASE WHEN MONTH(GETDATE()) = 1 THEN 12 ELSE MONTH(GETDATE()) - 1 END) AND EINK= 'M' AND FOB_VERÐ > CIF_VERÐ"
"Meðalverð (verð/þyngd) er of hátt/lágt fyrir eink-tlsk-land, stig 1, fj>10","id IN (SELECT id FROM HRÁAR2019 F JOIN  MEÐALVERÐ M ON M.EINK = F.EINK AND M.TLSK=F.TLSK AND M.LAND=F.LAND WHERE (M.EINK ='M' AND ((CASE ÞYNGD WHEN 0 THEN CIF_VERÐ ELSE CIF_VERÐ/ÞYNGD END)<(VM_M-VM_S) OR (CASE ÞYNGD WHEN 0 THEN CIF_VERÐ ELSE CIF_VERÐ/ÞYNGD END)>(VM_S+VM_M))) OR (M.EINK ='X' AND ((CASE ÞYNGD WHEN 0 THEN FOB_VERÐ ELSE CIF_VERÐ/ÞYNGD END)<(VM_M-VM_S) OR (CASE ÞYNGD WHEN 0 THEN FOB_VERÐ ELSE FOB_VERÐ/ÞYNGD END)>(VM_S+VM_M))))"
"Meðalverð (verð/eifj) er of hátt/lágt fyrir eink-tlsk-land, stig 1, fj>10","id IN (SELECT id FROM HRÁAR2019 F JOIN  MEÐALVERÐ M ON M.EINK = F.EINK AND M.TLSK=F.TLSK AND M.LAND=F.LAND WHERE (M.EINK ='M' AND ((CASE EIFJ WHEN 0 THEN CIF_VERÐ ELSE CIF_VERÐ/EIFJ END)<(VM_M-VM_S) OR (CASE EIFJ WHEN 0 THEN CIF_VERÐ ELSE CIF_VERÐ/EIFJ END)>(VM_S+VM_M))) OR (M.EINK ='X' AND ((CASE EIFJ WHEN 0 THEN FOB_VERÐ ELSE CIF_VERÐ/EIFJ END)<(VM_M-VM_S) OR (CASE EIFJ WHEN 0 THEN FOB_VERÐ ELSE FOB_VERÐ/EIFJ END)>(VM_S+VM_M))))"
"Meðalverð (þyngd/eifj) er of hátt/lágt fyrir eink-tlsk-land, stig 1, fj>10","id IN (SELECT id FROM HRÁAR2019 F JOIN  MEÐALVERÐ M ON M.EINK = F.EINK AND M.TLSK=F.TLSK AND M.LAND=F.LAND WHERE (M.EINK ='M' AND ((CASE EIFJ WHEN 0 THEN CIF_VERÐ ELSE ÞYNGD/EIFJ END)<(VM_M-VM_S) OR (CASE EIFJ WHEN 0 THEN CIF_VERÐ ELSE ÞYNGD/EIFJ END)>(VM_S+VM_M))) OR (M.EINK ='X' AND ((CASE EIFJ WHEN 0 THEN FOB_VERÐ ELSE ÞYNGD/EIFJ END)<(VM_M-VM_S) OR (CASE EIFJ WHEN 0 THEN ÞYNGD ELSE ÞYNGD/EIFJ END)>(VM_S+VM_M))))"
"Meðalverð (verð/þyngd),(verð/eifj) og (magn/eifj) er of hátt/lágt fyrir eink-tlsk-land, stig 1, fj>10","id IN (SELECT id FROM HRÁAR2019 F JOIN  MEÐALVERÐ M ON M.EINK = F.EINK AND M.TLSK=F.TLSK AND M.LAND=F.LAND WHERE (M.EINK = 'M' AND ((CASE ÞYNGD WHEN 0 THEN CIF_VERÐ ELSE CIF_VERÐ/ÞYNGD END)<(VM_M-VM_S) OR (CASE ÞYNGD WHEN 0 THEN CIF_VERÐ ELSE CIF_VERÐ/ÞYNGD END)>(VM_S+VM_M)) AND ((CASE F.EIFJ WHEN 0 THEN CIF_VERÐ ELSE CIF_VERÐ/F.EIFJ END)<(VE_M-VE_S) OR (CASE  F.EIFJ WHEN 0 THEN CIF_VERÐ ELSE CIF_VERÐ/F.EIFJ END)>(VE_S+VE_M)) AND ((CASE F.EIFJ WHEN 0 THEN ÞYNGD ELSE ÞYNGD/F.EIFJ END)<(ME_M-ME_S) OR (CASE F.EIFJ WHEN 0 THEN ÞYNGD ELSE ÞYNGD/F.EIFJ END)>(ME_S+ME_M))) OR (M.EINK = 'X' AND ((CASE ÞYNGD WHEN 0 THEN FOB_VERÐ ELSE FOB_VERÐ/ÞYNGD END)<(VM_M-VM_S) OR (CASE ÞYNGD WHEN 0 THEN FOB_VERÐ ELSE FOB_VERÐ/ÞYNGD END)>(VM_S+VM_M)) AND ((CASE F.EIFJ WHEN 0 THEN FOB_VERÐ ELSE FOB_VERÐ/F.EIFJ END)<(VE_M-VE_S) OR (CASE  F.EIFJ WHEN 0 THEN FOB_VERÐ ELSE FOB_VERÐ/F.EIFJ END)>(VE_S+VE_M)) AND ((CASE F.EIFJ WHEN 0 THEN ÞYNGD ELSE ÞYNGD/F.EIFJ END)<(ME_M-ME_S) OR (CASE F.EIFJ WHEN 0 THEN ÞYNGD ELSE ÞYNGD/F.EIFJ END)>(ME_S+ME_M))))"
"Meðalverð (verð/þyngd) er of hátt/lágt fyrir eink-tlsk, stig 2, fj<10","id IN (SELECT id FROM HRÁAR2019 F JOIN  MEÐALVERÐ M ON M.EINK = F.EINK AND M.TLSK=F.TLSK AND M.LAND=F.LAND WHERE (M.EINK ='M' AND ((CASE ÞYNGD WHEN 0 THEN CIF_VERÐ ELSE CIF_VERÐ/ÞYNGD END)<(VM_M-VM_S) OR (CASE ÞYNGD WHEN 0 THEN CIF_VERÐ ELSE CIF_VERÐ/ÞYNGD END)>(VM_S+VM_M))) OR (M.EINK ='X' AND ((CASE ÞYNGD WHEN 0 THEN FOB_VERÐ ELSE CIF_VERÐ/ÞYNGD END)<(VM_M-VM_S) OR (CASE ÞYNGD WHEN 0 THEN FOB_VERÐ ELSE FOB_VERÐ/ÞYNGD END)>(VM_S+VM_M))))"
"Meðalverð (verð/eifj) er of hátt/lágt fyrir eink-tlsk, stig 2, fj<10","id IN (SELECT id FROM HRÁAR2019 F JOIN  MEÐALVERÐ M ON M.EINK = F.EINK AND M.TLSK=F.TLSK AND M.LAND=F.LAND WHERE (m.eink = 'M' and ((CASE eifj WHEN 0 THEN cif_verð ELSE cif_verð/eifj END)<(VM_M-VM_S) or (CASE eifj WHEN 0 THEN cif_verð ELSE cif_verð/eifj END)>(VM_S+VM_M))) or(m.eink = 'X' and ((CASE eifj WHEN 0 THEN fob_verð ELSE cif_verð/eifj END)<(VM_M-VM_S) or (CASE eifj WHEN 0 THEN fob_verð ELSE fob_verð/eifj END)>(VM_S+VM_M))))"
"Meðalverð (þyngd/eifj) er of hátt/lágt fyrir eink-tlsk, stig 2, fj<10","id IN (SELECT id FROM HRÁAR2019 F JOIN  MEÐALVERÐ M ON M.EINK = F.EINK AND M.TLSK=F.TLSK AND M.LAND=F.LAND WHERE (M.EINK ='M' AND ((CASE EIFJ WHEN 0 THEN CIF_VERÐ ELSE ÞYNGD/EIFJ END)<(VM_M-VM_S) OR (CASE EIFJ WHEN 0 THEN CIF_VERÐ ELSE ÞYNGD/EIFJ END)>(VM_S+VM_M))) OR (M.EINK ='X' AND ((CASE EIFJ WHEN 0 THEN FOB_VERÐ ELSE ÞYNGD/EIFJ END)<(VM_M-VM_S) OR (CASE EIFJ WHEN 0 THEN ÞYNGD ELSE ÞYNGD/EIFJ END)>(VM_S+VM_M))))"
"Meðalverð (verð/þyngd), (verð/eifj) og (magn/eifj) er hátt/lágt fyrir eink-tlsk, stig 2, fj>10","id IN (SELECT id FROM HRÁAR2019 F JOIN  MEÐALVERÐ M ON M.EINK = F.EINK AND M.TLSK=F.TLSK AND M.LAND=F.LAND WHERE (M.EINK = 'M' AND ((CASE ÞYNGD WHEN 0 THEN CIF_VERÐ ELSE CIF_VERÐ/ÞYNGD END)<(VM_M-VM_S) OR (CASE ÞYNGD WHEN 0 THEN CIF_VERÐ ELSE CIF_VERÐ/ÞYNGD END)>(VM_S+VM_M)) AND ((CASE F.EIFJ WHEN 0 THEN CIF_VERÐ ELSE CIF_VERÐ/F.EIFJ END)<(VE_M-VE_S) OR (CASE  F.EIFJ WHEN 0 THEN CIF_VERÐ ELSE CIF_VERÐ/F.EIFJ END)>(VE_S+VE_M)) AND ((CASE F.EIFJ WHEN 0 THEN ÞYNGD ELSE ÞYNGD/F.EIFJ END)<(ME_M-ME_S) OR (CASE F.EIFJ WHEN 0 THEN ÞYNGD ELSE ÞYNGD/F.EIFJ END)>(ME_S+ME_M))) OR (M.EINK = 'X' AND ((CASE ÞYNGD WHEN 0 THEN FOB_VERÐ ELSE FOB_VERÐ/ÞYNGD END)<(VM_M-VM_S) OR (CASE ÞYNGD WHEN 0 THEN FOB_VERÐ ELSE FOB_VERÐ/ÞYNGD END)>(VM_S+VM_M)) AND ((CASE F.EIFJ WHEN 0 THEN FOB_VERÐ ELSE FOB_VERÐ/F.EIFJ END)<(VE_M-VE_S) OR (CASE  F.EIFJ WHEN 0 THEN FOB_VERÐ ELSE FOB_VERÐ/F.EIFJ END)>(VE_S+VE_M)) AND ((CASE F.EIFJ WHEN 0 THEN ÞYNGD ELSE ÞYNGD/F.EIFJ END)<(ME_M-ME_S) OR (CASE F.EIFJ WHEN 0 THEN ÞYNGD ELSE ÞYNGD/F.EIFJ END)>(ME_S+ME_M))))"
"EINK,TLSK,LAND hefur ekki komið fyrir síðustu 12 mán. T.d. við höfum ekki verið að flytja út ákveðna vöru til ákveðins lands seinustu 12 mánuði.","id NOT IN (SELECT A.id FROM HRÁAR2019 A JOIN MEÐALVERÐSGRUNNUR F ON A.EINK = F.EINK AND A.TLSK=F.TLSK AND A.LAND=F.LAND WHERE RIGHT(AFGRMAN,2) = (CASE WHEN MONTH(GETDATE()) = 1 THEN 12 ELSE MONTH(GETDATE()) - 1 END)) AND RIGHT(AFGRMAN,2) = (CASE WHEN MONTH(GETDATE()) = 1 THEN 12 ELSE MONTH(GETDATE()) - 1 END)"
"Land er Serbía og Svartfjallaland","RIGHT(AFGRMAN,2) = (CASE WHEN MONTH(GETDATE()) = 1 THEN 12 ELSE MONTH(GETDATE()) - 1 END) AND LAND= 'CS'"
"Land er Eþíópía","RIGHT(AFGRMAN,2) = (CASE WHEN MONTH(GETDATE()) = 1 THEN 12 ELSE MONTH(GETDATE()) - 1 END) AND LAND= 'ET'"
"Land er Ekvador","RIGHT(AFGRMAN,2) = (CASE WHEN MONTH(GETDATE()) = 1 THEN 12 ELSE MONTH(GETDATE()) - 1 END) AND LAND= 'EC'"
"Land er El Salvador","RIGHT(AFGRMAN,2) = (CASE WHEN MONTH(GETDATE()) = 1 THEN 12 ELSE MONTH(GETDATE()) - 1 END) AND LAND= 'SV'"
"Land er Dóminíka","RIGHT(AFGRMAN,2) = (CASE WHEN MONTH(GETDATE()) = 1 THEN 12 ELSE MONTH(GETDATE()) - 1 END) AND LAND= 'DM'"
"Land er Ísland","RIGHT(AFGRMAN,2) = (CASE WHEN MONTH(GETDATE()) = 1 THEN 12 ELSE MONTH(GETDATE()) - 1 END) AND LAND= 'IS'"
"Land er Tókelau","RIGHT(AFGRMAN,2) = (CASE WHEN MONTH(GETDATE()) = 1 THEN 12 ELSE MONTH(GETDATE()) - 1 END) AND LAND= 'TK'"
"Land er St. Kitts og Nevis","RIGHT(AFGRMAN,2) = (CASE WHEN MONTH(GETDATE()) = 1 THEN 12 ELSE MONTH(GETDATE()) - 1 END) AND LAND= 'KN'"
"Land er Ástralía","RIGHT(AFGRMAN,2) = (CASE WHEN MONTH(GETDATE()) = 1 THEN 12 ELSE MONTH(GETDATE()) - 1 END) AND LAND= 'AU'"
"Land er Sierra Leone","RIGHT(AFGRMAN,2) = (CASE WHEN MONTH(GETDATE()) = 1 THEN 12 ELSE MONTH(GETDATE()) - 1 END) AND LAND= 'SL'"
"Land er Norður-Kórea","RIGHT(AFGRMAN,2) = (CASE WHEN MONTH(GETDATE()) = 1 THEN 12 ELSE MONTH(GETDATE()) - 1 END) AND LAND= 'KP'"
"Land er Níger","RIGHT(AFGRMAN,2) = (CASE WHEN MONTH(GETDATE()) = 1 THEN 12 ELSE MONTH(GETDATE()) - 1 END) AND LAND= 'NE'"
"Land er Georgía","RIGHT(AFGRMAN,2) = (CASE WHEN MONTH(GETDATE()) = 1 THEN 12 ELSE MONTH(GETDATE()) - 1 END) AND LAND= 'GE'"
"Undanþágan HVNRV, Hitaveita Reykjavíkur vegna Nesjavallavirkjunar. Aðeins fyrir innfl.","UNDANÞÁGA= 'HVNRV'"
"Undanþágan HVSNE Hitaveita Suðurnesja 5. áfangi jarðgufuvirkjunar Svartsengi. Aðeins fyrir innfl.","UNDANÞÁGA= 'HVSNE'"
"Undanþágan JARNB Íslenska járnblendifélagið hf, Grundartanga, Hvalfirði. Aðeins fyrir innfl.","UNDANÞÁGA= 'JARNB'"
"Undanþágan LANDV Landsvirkjun vegna tiltekinna virkjanaframkvæmda. Aðeins fyrir innfl.","UNDANÞÁGA= 'LANDV'"
"Undanþágan LÖT19 Vörugjald (M* gjald) ökutæki endurselt úr landi. Aðeins fyrir innfl.","UNDANÞÁGA= 'LÖT19'"
"Undanþágan NORAL Norðurál hf -  álver við Grundartanga, Hvalfirði. Aðeins fyrir innfl.","UNDANÞÁGA= 'NORAL'"
"Undanþágan T0007 Vörur sem eru endursendar til Íslands frá útlöndum.","UNDANÞÁGA= 'T0007'"
"Undanþágan T0016 Tímabundinn innflutningur - vörur til sýningar/tæki til reynslu. Aðeins fyrir innfl.","UNDANÞÁGA= 'T0016'"
"Undanþágan T0017 Tímabundinn innflutningur - búnaður vísindamanna og fleiri aðila. Aðeins fyrir innfl.","UNDANÞÁGA= 'T0017'"
"Undanþágan T0018 Tímabundinn innflutningur - vara til viðgerðar og aðvinnslu. Aðeins fyrir innfl.","UNDANÞÁGA= 'T0018'"
"Undanþágan T0019 Tímabundinn innflutningur - aðv. til að forða vöru frá skemmdum. Aðeins fyrir innfl.","UNDANÞÁGA= 'T0019'"
"Undanþágan T0020 Tímabundinn innflutningur - ökutæki ferðamanna og varahlutir. Aðeins fyrir innfl.","UNDANÞÁGA= 'T0020'"
"Undanþágan T0021 Tímabundinn innflutningur - gjöld greidd af leigu tækja og ökut.. Aðeins fyrir innfl.","UNDANÞÁGA= 'T0021'"
"Undanþágan T0022 Tollafgreiddar vörur seldar ónotaðar til útlanda eða í fríhöfn. Aðeins fyrir innfl.","UNDANÞÁGA= 'T0022'"
"Undanþágan T0304 Aðilar sem undanþegnir eru tollskyldu með sérstökum lögum. Aðeins fyrir innfl.","UNDANÞÁGA= 'T0304'"
"Undanþágan T1110 Þegar uppboðsandvirði nær ekki álögðum aðflutningsgjöldum. Aðeins fyrir innfl.","UNDANÞÁGA= 'T1110'"
"Undanþágan T9000 Vara endurseld á Frísvæði. Aðeins fyrir innfl.","UNDANÞÁGA= 'T9000'"
"Tilvísun ekki til","UNDANÞÁGA NOT IN (SELECT UNDANÞÁGUR FROM UNDANÞÁGUR_ALLAR) AND UNDANÞÁGA IS NOT NULL"
"Kennitala er kennitala varnarliðsins sem er 6402770179","RIGHT(AFGRMAN,2) = (CASE WHEN MONTH(GETDATE()) = 1 THEN 12 ELSE MONTH(GETDATE()) - 1 END) AND KT= '6402770179'"
"BB-bráðabirgðaafgreiðsla v/tímabundins innfluttings. Aðeins fyrir innfl.","RIGHT(AFGRMAN,2)=(CASE WHEN MONTH(GETDATE()) = 1 THEN 12 ELSE MONTH(GETDATE()) - 1 END) AND AFGRTEG = 'BB' AND EINK= 'M'"
"BC-bráðabirgðarafgreiðsla v/tímabundins ATA- Carnet. Aðeins fyrir innfl.","RIGHT(AFGRMAN,2)=(CASE WHEN MONTH(GETDATE()) = 1 THEN 12 ELSE MONTH(GETDATE()) - 1 END) AND AFGRTEG = 'BC' AND EINK= 'M'"
"BD-bráðabrigðaafgreiðasla v/dagblaða og tímarita. Aðeins fyrir innfl.","RIGHT(AFGRMAN,2)=(CASE WHEN MONTH(GETDATE()) = 1 THEN 12 ELSE MONTH(GETDATE()) - 1 END) AND AFGRTEG = 'BD' AND EINK= 'M'"
"BF-bráðabrigðaafgreiðasla v/ferðamannabíla. Aðeins fyrir innfl.","RIGHT(AFGRMAN,2)=(CASE WHEN MONTH(GETDATE()) = 1 THEN 12 ELSE MONTH(GETDATE()) - 1 END) AND AFGRTEG = 'BF' AND EINK= 'M'"
"BL-bráðabrigðaafgreiðasla v/leigu. Aðeins fyrir innfl.","RIGHT(AFGRMAN,2)=(CASE WHEN MONTH(GETDATE()) = 1 THEN 12 ELSE MONTH(GETDATE()) - 1 END) AND AFGRTEG = 'BL' AND EINK= 'M'"
"BN-bráðabrigðaafgreiðasla v/neyðarleyfis. Aðeins fyrir innfl.","RIGHT(AFGRMAN,2)=(CASE WHEN MONTH(GETDATE()) = 1 THEN 12 ELSE MONTH(GETDATE()) - 1 END) AND AFGRTEG = 'BN' AND EINK= 'M'"
"BS-bráðabrigðaafgreiðasla v/sýningarbíla. Aðeins fyrir innfl.","RIGHT(AFGRMAN,2)=(CASE WHEN MONTH(GETDATE()) = 1 THEN 12 ELSE MONTH(GETDATE()) - 1 END) AND AFGRTEG = 'BS' AND EINK= 'M'"
"BT-bráðabrigðaafgreiðasla v/umflutnings(transit). Aðeins fyrir innfl.","RIGHT(AFGRMAN,2)=(CASE WHEN MONTH(GETDATE()) = 1 THEN 12 ELSE MONTH(GETDATE()) - 1 END) AND AFGRTEG = 'BT' AND EINK= 'M'"
"BV-bráðabrigðaafgreiðasla þegar skjöl vantar. Aðeins fyrir innfl.","RIGHT(AFGRMAN,2)=(CASE WHEN MONTH(GETDATE()) = 1 THEN 12 ELSE MONTH(GETDATE()) - 1 END) AND AFGRTEG = 'BV' AND EINK= 'M'"
"UT-Almennur útflutningur/umflutningur. Aðeinsfyrir útfl.","RIGHT(AFGRMAN,2)=(CASE WHEN MONTH(GETDATE()) = 1 THEN 12 ELSE MONTH(GETDATE()) - 1 END) AND AFGRTEG = 'UT' AND EINK= 'X'"
"UU-Endurútflutningur/umflutningur. Aðeinsfyrir útfl.","RIGHT(AFGRMAN,2)=(CASE WHEN MONTH(GETDATE()) = 1 THEN 12 ELSE MONTH(GETDATE()) - 1 END) AND AFGRTEG = 'UU' AND EINK= 'X'"
"U2-bráðabirgðaafgreiðsla/umflutningur. Aðeinsfyrir útfl.","RIGHT(AFGRMAN,2)=(CASE WHEN MONTH(GETDATE()) = 1 THEN 12 ELSE MONTH(GETDATE()) - 1 END) AND AFGRTEG = 'U2' AND EINK= 'X'"
"Tegund afgreiðslu ekki til. Aðeinsfyrir útfl.","RIGHT(AFGRMAN,2)=(CASE WHEN MONTH(GETDATE()) = 1 THEN 12 ELSE MONTH(GETDATE()) - 1 END) AND AFGRTEG IS NULL AND EINK= 'X'"
"Tegund viðskipta 0 og tollmeðferð 10, þeas sala á íslenskri vöru til útlanda. Aðeins til útfl.","RIGHT(AFGRMAN,2)=(CASE WHEN MONTH(GETDATE()) = 1 THEN 12 ELSE MONTH(GETDATE()) - 1 END) AND TEG_VIÐSKIPTA = '0' AND TOLLMEÐFERÐ = '10' AND EINK= 'X'"
"Tegund viðskipta 0 og tollmeðferð 15, þeas áður infl. vörur endurseldar til útlanda. Aðeins til útfl.","RIGHT(AFGRMAN,2)=(CASE WHEN MONTH(GETDATE()) = 1 THEN 12 ELSE MONTH(GETDATE()) - 1 END) AND TEG_VIÐSKIPTA = '0' AND TOLLMEÐFERÐ = '15' AND EINK= 'X'"
"Tegund viðskipta 0 og tollmeðferð 21, þeas vara send erl. til aðvinnslu önnur en spunavara. Aðeins til útfl.","RIGHT(AFGRMAN,2)=(CASE WHEN MONTH(GETDATE()) = 1 THEN 12 ELSE MONTH(GETDATE()) - 1 END) AND TEG_VIÐSKIPTA = '0' AND TOLLMEÐFERÐ = '21' AND EINK= 'X'"
"Tegund viðskipta 0 og tollmeðferð 23, þeas spunavara send erl. til aðvinnslu. Aðeins til útfl.","RIGHT(AFGRMAN,2)=(CASE WHEN MONTH(GETDATE()) = 1 THEN 12 ELSE MONTH(GETDATE()) - 1 END) AND TEG_VIÐSKIPTA = '0' AND TOLLMEÐFERÐ = '23' AND EINK= 'X'"
"Tegund viðskipta 0 og tollmeðferð 30, þeas áður innfl. vara endursend. Aðeins til útfl.","RIGHT(AFGRMAN,2)=(CASE WHEN MONTH(GETDATE()) = 1 THEN 12 ELSE MONTH(GETDATE()) - 1 END) AND TEG_VIÐSKIPTA = '0' AND TOLLMEÐFERÐ = '30' AND EINK= 'X'"
"Tegund viðskipta 0 og tollmeðferð 31, þeas endurútflut eftir aðvinnslu á Íslandi. Aðeins til útfl.","RIGHT(AFGRMAN,2)=(CASE WHEN MONTH(GETDATE()) = 1 THEN 12 ELSE MONTH(GETDATE()) - 1 END) AND TEG_VIÐSKIPTA = '0' AND TOLLMEÐFERÐ = '31' AND EINK= 'X'"
"Tegund viðskipta 0 og tollmeðferð 32, þeas endurútflut eftir viðgerð á Íslandi. Aðeins til útfl.","RIGHT(AFGRMAN,2)=(CASE WHEN MONTH(GETDATE()) = 1 THEN 12 ELSE MONTH(GETDATE()) - 1 END) AND TEG_VIÐSKIPTA = '0' AND TOLLMEÐFERÐ = '32' AND EINK= 'X'"
"Tegund viðskipta 0 og tollmeðferð 33, þeas endurútfl. eftir aðv. og endurgr./niðurf. tolla. Aðeins til útfl.","RIGHT(AFGRMAN,2)=(CASE WHEN MONTH(GETDATE()) = 1 THEN 12 ELSE MONTH(GETDATE()) - 1 END) AND TEG_VIÐSKIPTA = '0' AND TOLLMEÐFERÐ = '33' AND EINK= 'X'"
"Tegund viðskipta 0 og tollmeðferð 35, þeas vara endurútflutt eftir tímabundinn innfl. Aðeins til útfl.","RIGHT(AFGRMAN,2)=(CASE WHEN MONTH(GETDATE()) = 1 THEN 12 ELSE MONTH(GETDATE()) - 1 END) AND TEG_VIÐSKIPTA = '0' AND TOLLMEÐFERÐ = '35' AND EINK= 'X'"
"Tegund viðskipta 1 og tollmeðferð 15, þeas áður infl. vörur endurseldar til útlanda. Aðeins til útfl.","RIGHT(AFGRMAN,2)=(CASE WHEN MONTH(GETDATE()) = 1 THEN 12 ELSE MONTH(GETDATE()) - 1 END) AND TEG_VIÐSKIPTA = '1' AND TOLLMEÐFERÐ = '15' AND EINK= 'X'"
"Tegund viðskipta 1 og tollmeðferð 30, þeas áður innfl. vara endursend. Aðeins til útfl.","RIGHT(AFGRMAN,2)=(CASE WHEN MONTH(GETDATE()) = 1 THEN 12 ELSE MONTH(GETDATE()) - 1 END) AND TEG_VIÐSKIPTA = '1' AND TOLLMEÐFERÐ = '30' AND EINK= 'X'"
"Tegund viðskipta 1 og tollmeðferð 35, þeas vara endurútflutt eftir tímabundinn innfl. Aðeins til útfl.","RIGHT(AFGRMAN,2)=(CASE WHEN MONTH(GETDATE()) = 1 THEN 12 ELSE MONTH(GETDATE()) - 1 END) AND TEG_VIÐSKIPTA = '1' AND TOLLMEÐFERÐ = '35' AND EINK= 'X'"
"03019101 – 03079920 fiskur","RIGHT(AFGRMAN,2)=(CASE WHEN MONTH(GETDATE()) = 1 THEN 12 ELSE MONTH(GETDATE()) - 1 END) AND TLSK > '03019101' AND TLSK < '03079920'"
"05111000 – 05119909 fiskur, dýrablóð og sæði","RIGHT(AFGRMAN,2)=(CASE WHEN MONTH(GETDATE()) = 1 THEN 12 ELSE MONTH(GETDATE()) - 1 END) AND TLSK > '05111000' AND TLSK < '05119909'"
"08030000 – 08043000 Bananar, döðlur, fíkjur og ananas","RIGHT(AFGRMAN,2)=(CASE WHEN MONTH(GETDATE()) = 1 THEN 12 ELSE MONTH(GETDATE()) - 1 END) AND TLSK > '08030000' AND TLSK < '08043000'"
"08051000 – 08059000 Applesínur, mandarínur, sítrónur og fleirra","RIGHT(AFGRMAN,2)=(CASE WHEN MONTH(GETDATE()) = 1 THEN 12 ELSE MONTH(GETDATE()) - 1 END) AND TLSK > '08051000' AND TLSK < '08059000'"
"08061000 ný vínber","RIGHT(AFGRMAN,2)=(CASE WHEN MONTH(GETDATE()) = 1 THEN 12 ELSE MONTH(GETDATE()) - 1 END) AND TLSK = '08061000'"
"08071100 – 08071900 melónur","RIGHT(AFGRMAN,2)=(CASE WHEN MONTH(GETDATE()) = 1 THEN 12 ELSE MONTH(GETDATE()) - 1 END) AND TLSK > '08071100' AND TLSK < '08071900'"
"09011100 – 09019000 Kaffi","RIGHT(AFGRMAN,2)=(CASE WHEN MONTH(GETDATE()) = 1 THEN 12 ELSE MONTH(GETDATE()) - 1 END) AND TLSK > '09011100' AND TLSK < '09019000'"
"22030021 – 22080099 öl, freyðivín, kampavín, hvítvín, rauðvín og fleirra","RIGHT(AFGRMAN,2)=(CASE WHEN MONTH(GETDATE()) = 1 THEN 12 ELSE MONTH(GETDATE()) - 1 END) AND TLSK > '22030021' AND TLSK < '22080099'"
"25062100 óunnið eða grófhöggvið kvartsít seinast notað 2006","RIGHT(AFGRMAN,2)=(CASE WHEN MONTH(GETDATE()) = 1 THEN 12 ELSE MONTH(GETDATE()) - 1 END) AND TLSK = '25062100'"
"26011200 Mótað járngrýti","RIGHT(AFGRMAN,2)=(CASE WHEN MONTH(GETDATE()) = 1 THEN 12 ELSE MONTH(GETDATE()) - 1 END) AND TLSK = '26011200'"
"27011100 gljákol","RIGHT(AFGRMAN,2)=(CASE WHEN MONTH(GETDATE()) = 1 THEN 12 ELSE MONTH(GETDATE()) - 1 END) AND TLSK = '27011100'"
"27040000 koks og hálfkoks úr steinkolum, brúnkolum eða mó","RIGHT(AFGRMAN,2)=(CASE WHEN MONTH(GETDATE()) = 1 THEN 12 ELSE MONTH(GETDATE()) - 1 END) AND TLSK = '27040000'"
"27101110 – 27101130 flugvéla-, blýlaust  og annað bensín seinast notað 2011","RIGHT(AFGRMAN,2)=(CASE WHEN MONTH(GETDATE()) = 1 THEN 12 ELSE MONTH(GETDATE()) - 1 END) AND TLSK > '27101110' AND TLSK < '27101130'"
"27101912 – 27101940 þotueldsneyti og olíur","RIGHT(AFGRMAN,2)=(CASE WHEN MONTH(GETDATE()) = 1 THEN 12 ELSE MONTH(GETDATE()) - 1 END) AND TLSK > '27101912' AND TLSK < '27101940'"
"28182000 áloxíð","RIGHT(AFGRMAN,2)=(CASE WHEN MONTH(GETDATE()) = 1 THEN 12 ELSE MONTH(GETDATE()) - 1 END) AND TLSK = '28182000'"
"28261200 – 28263000 flúor í ýmsum útgáfum","RIGHT(AFGRMAN,2)=(CASE WHEN MONTH(GETDATE()) = 1 THEN 12 ELSE MONTH(GETDATE()) - 1 END) AND TLSK > '28261200' AND TLSK < '28263000'"
"38013000 Kolefniskennt deig í rafskaut og áþekk deig í ofnklæðningu","RIGHT(AFGRMAN,2)=(CASE WHEN MONTH(GETDATE()) = 1 THEN 12 ELSE MONTH(GETDATE()) - 1 END) AND TLSK = '38013000'"
